price,calories,name,description
continuous,continuous,string,string
,,meta,meta
5.95,650.0,Belgian Waffles,Two of our famous Belgian Waffles with plenty of real maple syrup
7.95,900.0,Strawberry Belgian Waffles,Light Belgian waffles covered with strawberries and whipped cream
8.95,900.0,Berry-Berry Belgian Waffles,Light Belgian waffles covered with an assortment of fresh berries and whipped cream
4.5,600.0,French Toast,Thick slices made from our homemade sourdough bread
6.95,950.0,Homestyle Breakfast,"Two eggs, bacon or sausage, toast, and our ever-popular hash browns"
